<!DOCTYPE users [
  <!ELEMENT users   (user_tuple*)>
  <!ELEMENT user_tuple (userid, name, rating?)>
  <!ELEMENT userid  (#PCDATA)>
  <!ELEMENT name    (#PCDATA)>
  <!ELEMENT rating  (#PCDATA)>
]>

<!DOCTYPE items [
  <!ELEMENT items       (item_tuple*)>
  <!ELEMENT item_tuple  (itemno, description, offered_by, 
                              start_date?, end_date?, reserve_price? )>
  <!ELEMENT itemno      (#PCDATA)>
  <!ELEMENT description (#PCDATA)>
  <!ELEMENT offered_by  (#PCDATA)>
  <!ELEMENT start_date  (#PCDATA)>
  <!ELEMENT end_date    (#PCDATA)>
  <!ELEMENT reserve_price (#PCDATA)>
]>

<!DOCTYPE bids [
  <!ELEMENT bids      (bid_tuple*)>
  <!ELEMENT bid_tuple (userid, itemno, bid, bid_date)>
  <!ELEMENT userid    (#PCDATA)>
  <!ELEMENT itemno    (#PCDATA)>
  <!ELEMENT bid       (#PCDATA)>
  <!ELEMENT bid_date  (#PCDATA)>
]>