<?xml version="1.0" standalone="no"?>
<!DOCTYPE users SYSTEM "uc4.dtd" >

<users>
  <user_tuple>
    <userid>U01</userid>
    <name>Tom Jones</name>
    <rating>B</rating>
  </user_tuple>

  <user_tuple>
    <userid>U02</userid>
    <name>Marry Doe</name>
    <rating>A</rating>
  </user_tuple>

  <user_tuple>
    <userid>U03</userid>
    <name>Dee Linguent</name>
    <rating>D</rating>
  </user_tuple>

  <user_tuple>
    <userid>U04</userid>
    <name>Roger Smith</name>
    <rating>C</rating>
  </user_tuple>

  <user_tuple>
    <userid>U05</userid>
    <name>Jack Sprat</name>
    <rating>B</rating>
  </user_tuple>

  <user_tuple>
    <userid>U06</userid>
    <name>Rip Van Kinkle</name>
    <rating>B</rating>
  </user_tuple>

</users>